{
  "schemaVersion": 1,
  "generatedAtUnixMs": 1787792400000,
  "records": [
    {
      "schemaVersion": 1,
      "source": "runtime",
      "period": {
        "start": "2026-08-28T10:00:00Z",
        "end": "2026-08-28T11:00:00Z"
      },
      "inputTokens": 1200,
      "outputTokens": 300,
      "isEstimate": true,
      "recordedAtUnixMs": 1787792400000
    }
  ],
  "totals": {
    "inputTokens": 1200,
    "outputTokens": 300,
    "estimateCount": 1
  }
}
